search query,article date,article title,article summary
hurricane irene,2011-08-29T14:19:02Z,Caucus Video: The Political Response to Irene,"The Obama administration took pains to avoid comparisons with Hurricane Katrina. In the New York area, elected officials displayed radically different approaches to the storm."
hurricane irene,2011-08-27T12:17:26Z,Are You Prepared or Unprepared for Irene?,WNYC and The New York Times want to hear about any signs you’re seeing that show the city is prepared or unprepared for the hurricane.
hurricane irene,2011-08-25T00:00:00Z,"From California, Advice for Next Time: Stay Inside","The time to evacuate a tall building, a California emergency management official said, is once an earthquake is over."
hurricane irene,2011-08-23T19:37:38Z,Rodriguez Scratched From Yankees Lineup,"Alex Rodriguez was scratched from the lineup with a jammed left thumb Tuesday, two hours before the Yankees were to play the Oakland Athletics at Yankee Stadium, a team spokesman said."
hurricane irene,2011-08-30T00:00:00Z,Yankees Salvage a Split but Lose Some Strength,"The Yankees, without Alex Rodriguez or Derek Jeter for the finale of their four-game series with the Orioles, head to Boston to face the division-leading Red Sox."
hurricane irene,2011-08-28T00:00:00Z,What's On Sunday,"9 P.M. (MTV) 2011 MTV VIDEO MUSIC AWARDS The awards dare to go hostless at this annual ceremony, broadcast live from the Nokia Theater in Los Angeles. Nominees for best new artist include Big Sean, Foster the People, Kreayshawn, Wiz Khalifa and Ty..."
hurricane irene,2011-08-28T00:00:00Z,Nadal Enters Open in Djokovic’s Shadow,"Rafael Nadal goes into the United States Open ranked second in the world, but he does so in a field where his rival Novak Djokovic is unquestionably the dominant power."
hurricane irene,2011-08-26T00:00:00Z,Dr. King Weeps From His Grave,The Rev. Dr. Martin Luther King Jr. never conflated a flesh-and-blood sacrifice with a stone-and-mortar edifice.
hurricane irene,2011-08-23T19:37:38Z,Rodriguez Scratched From Yankees Lineup,"Alex Rodriguez was scratched from the lineup with a jammed left thumb Tuesday, two hours before the Yankees were to play the Oakland Athletics at Yankee Stadium, a team spokesman said."
hurricane irene,2011-08-28T10:25:03Z,Will New York Be Lulled by Moderate Hurricane Surge?,"Irene weakens after swirling through New York City, but leaves a sodden path."
hurricane irene,2011-08-26T10:34:45Z,Storm Threat Closes Broadway,"With Hurricane Irene bearing down on the New York area, a number of weekend cultural events have been postponed or canceled."
hurricane irene,2011-08-25T00:00:00Z,"In Mountain Village, Cuomo Finds Respite",Gov. Andrew M. Cuomo’s visits to Saranac Lake have shined a spotlight one of New York’s lesser-known tourist attractions.
hurricane irene,2011-08-30T10:45:25Z,Morning Take-Out,Highlights from the DealBook newsletter.
hurricane irene,2011-08-30T14:45:25+0000,Morning Take-Out,Highlights from the DealBook newsletter.
hurricane irene,2011-08-29T22:00:54Z,"At the Open, Two Players from Ireland Make History",Niland and Sorensen are the first from their country to compete in the main draw.
hurricane irene,2011-08-29T13:56:56Z,The Caucus | Political Response to Irene,"In Washington, the Obama administration took pains to avoid comparisons with Hurricane Katrina. In the New York area, elected officials took radically different approaches to the storm."
hurricane irene,2011-08-29T22:00:54Z,"At the Open, Two Players from Ireland Make History",Niland and Sorensen are the first from their country to compete in the main draw.
hurricane irene,2011-08-30T00:00:00Z,Uneven Night for Quarterbacks and Their Teams,The Jets’ Mark Sanchez and the Giants’ Eli Manning were unimpressive in the final dress rehearsal for the teams’ top players.
hurricane irene,2011-08-28T00:00:00Z,Johnson Charges to Sodden Victory at the Barclays,"Attacking Plainfield Country Club’s soaked course, Dustin Johnson prevailed, moving into first place in the FedEx Cup standings."
hurricane irene,2011-08-27T00:00:00Z,One Lost Day Follows Another,"For the second consecutive start and the third time in his last five, A. J. Burnett was nothing short of terrible as the Orioles pounded the Yankees in front of a crowd of 32,762 at Camden Yards."
hurricane irene,2011-08-24T10:09:28+0000,"In Mineral, Va., Sudden Fame as Quake’s Epicenter","A small town previously known, to the extent it was known at all, for its mineral deposits has now gained notice for another geological phenomenon."
hurricane irene,2011-08-29T16:03:47Z,It Was a Dark and Sort of Stormy Night,We ate a lot of spaghetti and my 2-year-old faced her fears.
hurricane irene,2011-08-30T00:00:00Z,Two Firsts for Irish Tennis,"When Novak Djokovic steps onto the court for his first round match at this year's Open, it'll be his New York debut as world number one, but it will be the unfamiliar player on the other side of the net who will be making history.  That man is Con..."
hurricane irene,2011-08-29T22:41:37Z,Arsenal's Embarrassment Leads to Free Ticket Offer,"Embarrassed by an 8-2 loss at Manchester United, Arsenal officials offered their thousands of traveling fans tangible payback by offering to pay for their match ticket to another away game if they dare go."
hurricane irene,2011-08-29T22:41:37Z,Arsenal's Embarrassment Leads to Free Ticket Offer,"Embarrassed by an 8-2 loss at Manchester United, Arsenal officials offered their thousands of traveling fans tangible payback by offering to pay for their match ticket to another away game   if they dare go."
hurricane irene,2011-08-28T00:00:00Z,The Sisterhood of Netball,"A fast and fierce game, netball is played almost exclusively by women, and in New York, a summer league consists almost entirely of Caribbean immigrants."
hurricane irene,2011-08-24T10:16:33Z,"Unflappable, but a Little Shaken",Why lose sleep over earthquakes in this city? Ruination here takes so many other forms.
hurricane irene,2011-08-24T10:16:33Z,"Unflappable, but a Little Shaken",Why lose sleep over earthquakes in this city? Ruination here takes so many other forms.
hurricane irene,2011-08-29T00:00:00Z,Mayor Making It No Secret: He’ll Endorse Quinn in 2013,"Any endorsement by Mayor Michael R. Bloomberg could prove a double-edged sword for Christine C. Quinn, the City Council speaker, analysts say."
hurricane irene,2011-08-30T00:00:00Z,Venus Williams Shows Rust and Resolve,"Williams came into her 13th Open having played 10 matches all year, but she overpowered Vesna Dolonts in straight sets for the victory."
hurricane irene,2011-08-29T00:00:00Z,Mayor Making It No Secret: He'll Endorse Quinn in 2013,"Any endorsement by Mayor Michael R. Bloomberg could prove a double-edged sword for Christine C. Quinn, the City Council speaker, analysts say."
hurricane irene,2011-08-28T00:00:00Z,"Writing’s on the Wall (Art Is, Too, for Now)","The graffiti mecca 5Pointz, in Long Island City, Queens, is living on borrowed time. It is destined to be replaced by two residential towers."
hurricane irene,2011-08-25T09:34:02Z,"With a Civil Trial Pending, the Strauss-Kahn Case Is Hardly Closed",The lawyer for Nafissatou Diallo has already begun framing the case in terms of class consciousness.
hurricane irene,2011-08-25T09:34:02Z,"With a Civil Trial Pending, the Strauss-Kahn Case Is Hardly Closed",The lawyer for Nafissatou Diallo has already begun framing the case in terms of class consciousness.
hurricane irene,2011-08-27T00:00:00Z,"Voluntarily Disclose Your Offshore Accounts, or Else","The second round of disclosure under an I.R.S. program ends Sept. 9, and the penalties are severe for those who don’t come forward."
hurricane irene,2011-08-26T00:00:00Z,"Beats, Bikes, Skateboards and the Big Time","The increasingly popular Afro-Punk Festival, after years celebrating an underground culture, was to embrace the big time this weekend before an impending storm forced organizers to cancel the Brooklyn festival."
hurricane irene,2011-08-23T09:14:01Z,"In Messy Strauss-Kahn Case, a Glimpse of a Working Justice System",Do we really want our district attorneys to pursue cases in which they have no faith?
hurricane irene,2011-08-23T09:14:01Z,"In Messy Strauss-Kahn Case, a Glimpse of a Working Justice System",Do we really want our district attorneys to pursue cases in which they have no faith?
hurricane irene,2011-08-28T21:17:04Z,The Union Finally Lands a Victory,The battle for Forts Hatteras and Clark was anticlimactic but proved to be significant for the North.
hurricane irene,2011-08-28T00:00:00Z,Commemorating Those Lost Through Time,"For every iconic American honored, there are also lesser known figures, each with a claim to historical significance and a memorial."
hurricane irene,2011-08-26T00:00:00Z,Pop and Rock Listings for Aug. 26-Sept. 1,"A selected guide to pop, rock, metal, punk, hip-hop, world and other music in New York and the area."
hurricane irene,2011-08-23T14:17:01Z,Earthquake Shakes Eastern United States,The Lede is providing updates on the aftermath of an earthquake that struck the eastern United States on Tuesday afternoon.
hurricane irene,2011-09-02T00:00:00Z,Nature’s Stimulus Package,Readers respond to recent coverage of Hurricane Irene.
hurricane irene,2011-09-01T00:00:00Z,"River, at 100-Year High, Ravages a City That Once Thrived on It",Paterson in North Jersey was still fighting back the highest floodwaters in over a century on Wednesday.
hurricane irene,2011-09-01T00:00:00Z,The Victims of Irene,A reader responds to a recent article about those who lost their lives due to Hurricane Irene.
hurricane irene,2011-09-02T21:18:30+0000,New York Was Calm as Irene Stormed Through,"The psyche of the city’s Type-A personalities changed as people relaxed, socialized and took time out."
hurricane irene,2011-09-02T00:00:00Z,"Different Leaders, Different Approaches",Here is how some governors in the East handled Hurricane Irene.
hurricane irene,2011-09-06T12:16:16Z,Coping With a Natural Disaster,Vince Morvillo of Sea Lake Yachts shares his tips for coping with an environmental disaster.
hurricane irene,2011-09-01T07:00:14Z,"After Tropical Storm Irene, a Bounty for Birdwatchers",Tropical Storm Irene was a windfall to one particular group of hobbyists: birders who are spotting birds almost never seen in New York that have been blown off course by the storm.
hurricane irene,2011-09-01T06:00:55Z,"Buyer Beware, as Damaged Cars from Tropical Storm Irene May Soon Arrive on Dealer Lots",Damaged cars and trucks from cities and towns affected by the storm are likely to make their way to auto auctions across the country in coming weeks and months.
hurricane irene,2011-09-17T17:34:56Z,Reads & Reactions,"Romney's strategy, Pennsylvania plans, special election tea leaves and hurricane-centered media criticism. Also, a special edition of Reads."
hurricane irene,2011-09-25T00:00:00Z,"Good Riddance, Irene","Throughout Westchester, homeowners are not only cleaning up after Tropical Storm Irene, but also fortifying their houses against the next one."
hurricane irene,2011-09-08T00:00:00Z,"In Congress, Storm Relief Is Grist for Dispute",Proposals regarding federal aid after Hurricane Irene have touched off a political storm over whether other programs should be cut to offset the cost.
hurricane irene,2011-09-02T17:08:16Z,Cuomo Faults Utilities on Slow Return of Power on L.I.,"With 66,000 customers still lacking power as of Friday afternoon, the governor said that the Long Island Power Authority needed to put the screws to National Grid, which runs its electric system."
hurricane irene,2011-09-05T00:00:00Z,"City Learns Lessons From the Storm, Many of Them the Hard Way","Changes both large and small will be made to the way New York City responds to hurricane emergencies in the future, officials say."
hurricane irene,2011-09-02T13:36:24Z,StellaService Revises Airlines' Hurricane Grades,Some big airlines' response time to Twitter inquiries during Hurricane Irene were better than a survey initially reported.
hurricane irene,2011-09-03T00:00:00Z,"A Time of Drenching Rain, Gusting Wind and Peculiar Crimes",Crimes committed during Tropical Storm Irene — however minor — carried the unique marks of the rough weather.
hurricane irene,2011-09-12T08:31:21Z,Poll Finds Bloomberg Weathering the Storms,"In a poll released Monday morning, New Yorkers gave the mayor high marks for handling Tropical Storm Irene and do not seem to have been bothered by his handling of the arrest of a deputy mayor. Mr. Bloomberg's approval numbers are 15 points higher..."
hurricane irene,2011-09-05T00:00:00Z,"In New Jersey, Obama Vows Federal Help, Not Washington Politics","As the president surveyed the damage, he was greeted by cheers and one person with a sign that pleaded, “Help Us.”"
hurricane irene,2011-09-02T01:30:08+0000,Eric and Irene,"Representative Eric Cantor, the House majority leader, wants any aid for Hurricane Irene victims to be offset by cuts in other spending. He had other ideas in 2004 when Gaston hit his state."
hurricane irene,2011-09-02T00:00:00Z,Relief in Vermont Towns as Crews Make Inroads,"Crude roads that can be traversed by all-terrain and four-wheel-drive vehicles have finally allowed aid, supplies and repair crews to reach towns isolated by this week’s flooding."
hurricane irene,2011-09-01T18:24:52Z,Clintons Hunkered Down in East Hampton as Irene Passed By,"Often guests in the area, this summer they put down temporary roots in a 1920 cottage. As long as there was power in the kitchen and phone service, Hillary said, they ""weren't going anywhere."""
hurricane irene,2011-09-20T17:25:23Z,"Response to Tropical Storm Irene Cost $55 Million, City Says",That estimate comes as the city prepares to apply for federal aid related to the storm.
hurricane irene,2011-09-07T15:17:49Z,The Tragic Legacy of Irene,Farmers in New York and Vermont discuss the devastation wrought on their livelihoods by Hurricane Irene.
hurricane irene,2011-09-06T00:00:00Z,"In a Storm&#8217;s Wake, Bracing for More Rain","As New York, New Jersey and Connecticut continue trying to dry out from Tropical Storm Irene, the remnants of another such storm, Lee, appear headed for the Northeast."
hurricane irene,2011-09-02T00:00:00Z,Stormy Weather for a Utility Merger,"After Irene left 220,000 without power in Connecticut, it may be harder to persuade regulators of the virtues of a utility merger."
hurricane irene,2011-09-09T13:53:59Z,Mean Irene,"A Vermont farmer discusses Hurricane Irene's effect on her work, and on rescuing her crops in time to feed her customers."
hurricane irene,2011-09-23T14:56:11Z,Links: The Week in Food,What we’re reading this week.
hurricane irene,2011-09-21T00:00:00Z,"In Waning Hours of Storm, a Crisis Not of Its Making","A tale of a police chase, an abandoned pocketbook and an officer in trouble, as Hurricane Irene hits Pawtucket, R.I."
hurricane irene,2011-09-02T14:40:54Z,Small Subtractions and Big Addition at Puck Building,"Something is missing atop the landmark Puck Building in Manhattan, but something bigger will come to the same spot."
hurricane irene,2011-09-02T00:00:00Z,"In Parks and on Streets, a Toll of Thousands of Trees","The parks department estimated that 1,200 to 1,500 trees on the city’s streets were knocked down by the storm."
hurricane irene,2011-09-20T13:05:33Z,Stop-Gap Bill Tied Up Over Disaster Aid Feud,The House and Senate are headed for a showdown over a short-term bill to fund the government because of a disagreement over disaster relief funding.
hurricane irene,2011-09-04T00:00:00Z,A Wedding Crasher Named Irene,"At the ceremony site in Chadds Ford, Pa., the lights flickered, the music stopped, and the dancers stood still."
hurricane irene,2011-09-21T00:00:00Z,Dispute on Disaster Aid Threatens Bill to Avert Government Shutdown,A dispute between the House and Senate over money for disaster relief is threatening a short-term bill to finance the government after Sept. 30.
hurricane irene,2011-09-13T15:12:08Z,Senate Tries Again on Disaster Aid,A proposal would provide $5.1 billion more for the Federal Emergency Management Agency.
hurricane irene,2011-09-01T00:00:00Z,"In the Adirondacks, Storm-Battered and Cut Off",Residents of this part of upstate New York thought they knew all the extremes that weather could heap on them. Then came Tropical Storm Irene.
hurricane irene,2011-09-02T00:00:00Z,"For the Governor of Vermont, a Crash Course in Disaster Management","Gov. Peter Shumlin of Vermont, a state unaccustomed to disasters, faces a complicated and costly recovery effort that could well be the defining issue of his governorship."
hurricane irene,2011-09-18T00:00:00Z,Storm Left Some Buyers in the Dark,"Those buying, selling or moving were especially stressed by Tropical Storm Irene — some had to postpone closings, others removed listings from the market."
hurricane irene,2011-09-07T00:00:00Z,G.O.P. Legislators Balk at a Call to Tie Storm Aid to Budget Cuts,The House majority leader has suggested that disaster aid must be offset by an equal amount in spending cuts. But representatives of affected areas reject that position.
hurricane irene,2011-09-05T00:00:00Z,Radio D.J. in the Catskills Offered a Lifeline During the Storm,"When the power went down across wide swaths of the Catskills during Tropical Storm Irene, Big Jay Fink was on the air."
hurricane irene,2011-09-26T00:00:00Z,Flood Victims Getting Fed Up With Congress,"TUNKHANNOCK, Pa. -- Standing in the living room of their house, now full of mud, slime and debris, Helen and Peter Kelly cannot believe that Congress is bickering over disaster aid to people like them.     The roaring waters of the Susquehanna Riv..."
hurricane irene,2011-09-12T02:46:41+0000,Just Try Topping This ‘When I Was Your Age’ Tale,Students in Vermont can honestly say they had to journey through a forest and across a mountain to get to school every day.
hurricane irene,2011-09-28T00:00:00Z,"Instead of Waiting for Storm Aid, Going Online in a Do-It-Yourself Movement","In regions hit hard by Tropical Storm Irene, residents are using new media to search for instant financial aid."
hurricane irene,2011-09-21T04:09:45Z,"Sept. 21, 1938 | Giant Hurricane Lashes Long Island and New England","On Sept. 21, 1938, a giant hurricane roared up the Eastern seaboard, causing extensive damage and loss of life on Long Island and much of New England, not relenting until it had crossed into Canada."
hurricane irene,2011-09-21T04:09:45Z,"Sept. 21, 1938 | Giant Hurricane Lashes Long Island and New England","On Sept. 21, 1938, a giant hurricane roared up the Eastern seaboard, causing extensive damage and loss of life on Long Island and much of New England, not relenting until it had crossed into Canada."
hurricane irene,2011-09-01T03:56:40+0000,Northeast Ravaged by Flooding,"Four days after Tropical Storm Irene, towns near the Passaic River in New Jersey struggled with flooding while wide swaths of the Northeast were still without power."
hurricane irene,2011-09-01T01:13:53+0000,"Covered Bridges, Beloved Remnants of Another Era, Were Casualties, Too",Bridge buffs watched in horror as antique covered bridges were damaged or swept away in the floods caused by Hurricane Irene.
hurricane irene,2011-09-15T16:45:01Z,Metro-North's Port Jervis Line Slowly Returns,"After the line's tracks were wiped away by Tropical Storm Irene, the M.T.A. has been able to restore a section of them. Combined with buses, N.J. Transit and PATH, a commuter can reach the city."
hurricane irene,2011-09-08T00:00:00Z,More Rain Worries Areas Hit Hard by Tropical Storm Irene,Areas struggling to recover from last month’s tropical storm are preparing for the potential of renewed flooding.
hurricane irene,2011-09-04T00:00:00Z,New Dramas on the Hill (and a Few Reruns),"As Congress returns to work this week, watch for some maneuvers on Capitol Hill."
hurricane irene,2011-09-02T12:14:13Z,Cuomo Calls for Volunteers to Clean Up After Irene,"The program, ""Labor for Your Neighbor,"" is set for Sunday and Monday in the Schoharie Valley, Catskills and North Country, and will be overseen by the National Guard and the state's Office of Emergency Management."
hurricane irene,2011-09-05T00:00:00Z,Vermont Turns Out for Its Dairies as They Take Stock and Dig Out,"Even after the Vermont floodwaters receded, the crisis continued for the state’s dairy farmers as they counted their losses and struggled to take care of the animals that survived."
hurricane irene,2011-09-03T00:00:00Z,Battered Vermont Looks First to Its Roads,There may be no challenge more daunting — or vital to solve — than repairing and reopening the hundreds of roads and dozens of bridges that Irene knocked out.
hurricane irene,2011-09-10T00:00:00Z,Flooding Persists in Southern Tier of New York,Areas along the border with Pennsylvania are still dealing with rivers swollen by the remnants of Tropical Storm Lee.
hurricane irene,2011-09-03T00:00:00Z,"Nearly Week Later, Thousands in Region Still Lack Clean Water","Across the New York region, people are carting plastic jugs, soda bottles and any handy receptacle to water filling stations."
hurricane irene,2011-09-07T15:17:49Z,The Tragic Legacy of Irene,Farmers in New York and Vermont discuss the devastation wrought on their livelihoods by Hurricane Irene.
hurricane irene,2011-09-22T00:00:00Z,"Even Without Its Bar, Catskill Tavern Still Serves Flood-Bruised Town","Since Tropical Storm Irene did its damage, the owner of Prattsville Tavern, Ken Cox, has been rebuilding and giving some regulars a place to stay."
hurricane irene,2011-09-02T01:34:57+0000,Port Jervis Train Line Will Take Months to Repair,"The 2,300 weekday commuters on the Metro-North Railroad’s Port Jervis line relish the peaceful ride, which has been disrupted by Tropical Storm Irene’s destruction."
hurricane irene,2011-09-02T00:00:00Z,Manor That Has Stood for Centuries Teeters in Storm’s Wake,"Water from Tropical Storm Irene seemed to take dead aim on the Guy Park Manor in Amsterdam, N.Y., and all its valuable contents."
hurricane irene,2011-09-28T00:00:00Z,Flooded Farmers Learn to Be Creative,"Their livelihood swallowed by Tropical Storm Irene, many Hudson Valley farmers have had to use their ingenuity and draw on the good will of their customers."
hurricane irene,2011-09-04T00:00:00Z,"Amid Mud and Floods, Push to Restore Power",Homeowners and businesses cleared out muck from flooding in the New York region as a lack of power persisted for some customers after Tropical Storm Irene.
hurricane irene,2011-09-01T07:00:14Z,"After Tropical Storm Irene, a Bounty for Birdwatchers",Tropical Storm Irene was a windfall to one particular group of hobbyists: birders who are spotting birds almost never seen in New York that have been blown off course by the storm.
hurricane irene,2011-09-18T00:00:00Z,A Stormy Housewarming,"For some new homeowners, Tropical Storm Irene was a confidence builder. Their houses, inland and on the water, weathered the storm in fine shape."
hurricane irene,2011-09-13T00:00:00Z,Fast-Track for Disaster Aid Is Blocked,Republicans blocked an effort Monday by Senate Democrats to quickly pass a $7 billion aid package for victims of recent natural disasters.
hurricane irene,2011-09-16T19:08:23Z,Driving the Saab 9-4X,"The editor of the Automobiles section reflects on his time behind the wheel of the Saab S.U.V., which is reviewed in this weekend's paper."
hurricane irene,2011-09-24T00:00:00Z,"Tropical Storm Is Long Gone, but an Evacuation Still Holds",Some residents of the Villa Charlotte Bronte in the Bronx who were exiled during Tropical Storm Irene are being told they cannot move back until they prove the building rests on solid ground.
hurricane irene,2011-09-02T00:00:00Z,Power Out to Hundreds of Thousands Around New York,"By Thursday evening, some 378,000 customers remained without electricity in New Jersey, Connecticut and Westchester County and on Long Island."
hurricane irene,2011-09-02T18:05:24Z,The Week in Pictures for Sept. 2,"Here is a slide show of photographs from the past week in New York City and the region. Subjects include dogs in bars, a dinner in white, and Tropical Storm Irene."
hurricane irene,2011-09-01T21:26:58Z,Aerial View of Beaches Shows More Danger Than Damage,"Tropical Storm Irene's toll in coastal areas of Brooklyn and Long Island was more a matter of weakening than of erasing, but without restoration, the coastline could be devastated by future storms."
hurricane irene,2011-09-06T12:16:16Z,Coping With a Natural Disaster,Vince Morvillo of Sea Lake Yachts shares his tips for coping with an environmental disaster.
hurricane irene,2011-09-03T17:29:08+0000,The Week’s Business News in Pictures,"In news around the nation last week, airports reopened in the Northeast after Hurricane Irene, the head of the National Labor Relations Board stepped down in Washington and a solar power company in California filed for bankruptcy, solidifying Chin..."
hurricane irene,2011-09-02T15:28:33Z,"After Irene, a Recovering New England","Roads and attractions are being repaired, and New England businesses are imploring travelers to keep the region in their fall itineraries."
hurricane irene,2011-09-03T00:00:00Z,Corrections,"An article on Friday about the new challenges facing Gov. Peter Shumlin of Vermont in the aftermath of Hurricane Irene described incorrectly the location of Vermont Yankee, a nuclear power plant that Mr. Shumlin wants shut down. It is in the south..."
hurricane irene,2011-09-05T00:00:00Z,Corrections,"FRONT PAGE     An article in some editions on Wednesday about the high financial costs that could arise from Hurricane Irene misspelled the given name of the Connecticut governor, who noted that the damage was massive in scope. He is Dannel P. Mal..."
