search query,article date,article title,article summary
hurricane irma,2018-06-03T01:03:06+0000,"Puerto Rico: How Do We Know 3,000 People Died as a Result of Hurricane Maria?",A guide to understanding the official death estimates for Puerto Rico as a result of Hurricane Maria.
hurricane irma,2018-06-05T18:38:57+0000,Turning Our Backs on Puerto Rico,"The U.S. government “refused to provide the necessary assistance, and thousands died needlessly as a result,” a reader says."
hurricane irma,2018-06-03T23:45:07+0000,The Shame in Puerto Rico,"A new study points to a far higher death toll from Hurricane Maria, more evidence of the Trump administration’s neglect."
hurricane irma,2018-06-01T23:03:34+0000,"Just in Time for Hurricane Season, a New Leader at the Coast Guard’s Helm",Adm. Karl L. Schultz said the military service will hold steady in its growing role in homeland security priorities like immigration and disaster relief.
hurricane irma,2018-06-23T09:00:08+0000,"The Cheeca Lodge Is Back, Tiki Bar and All","Hurricane Irma severely damaged the long-running resort in the Florida Keys. Six months later, the redesigned property offers delicious dining, an inviting spa and a few hiccups."
hurricane irma,2018-06-27T09:00:16+0000,Tropical Forests Suffered Near-Record Tree Losses in 2017,New satellite data reveals that the world’s tropical forests lost roughly 39 million acres of trees last year — an area the size of Bangladesh. 
hurricane irma,2018-07-13T22:56:17+0000,FEMA Admits It Failed Puerto Rico. Can It Do Any Better? ,The agency’s disorganization and a lack of supplies and personnel contributed to the havoc.
hurricane irma,2018-07-12T22:23:24+0000,"FEMA Was Sorely Unprepared for Puerto Rico Hurricane, Report Says","When a killer storm came to Puerto Rico, FEMA’s warehouse on the island was nearly empty, with not a single tarpaulin or cot left in stock."
hurricane irma,2018-07-12T15:16:07+0000,Hurricane Maria Killed Our Loved Ones. We Want Closure.,"The 2017 hurricane killed 70 times more people in Puerto Rico than the official estimate. As relatives of unrecognized victims, how can we begin to heal?"
hurricane irma,2018-07-02T00:25:09+0000,"For Puerto Rican Evacuees, a Journey Without End","With a federal shelter-aid program expiring, a family displaced by Hurricane Maria moved over the weekend to a hotel run by New York City’s homeless-shelter system."
hurricane irma,2018-07-07T10:00:01+0000,Bomba: The Enduring Anthem of Puerto Rico,The resurgence of a traditional Afro-Puerto Rican musical genre owes something to formal experimentation. But some traditionalists fear that its roots are at risk.
hurricane irma,2018-07-12T22:07:41+0000,Samantha Bee on Her Emmy Nominations and the Changing Face of Late Night,Ms. Bee spoke about her special on Puerto Rico and about the aftermath of her use of a vulgar epithet to describe Ivanka Trump.
hurricane irma,2018-07-20T08:00:05+0000,Beauty and Bleakness: The Efforts to Conserve Coral Reefs,"As coral ecosystems face worldwide decline, Alexis Rosenfeld and Alexie Valois were set on chronicling their majesty and their plight — as well as efforts to restore them."
hurricane irma,2018-07-04T20:35:53+0000,"Henry Butler, Quintessential New Orleans Pianist, Is Dead at 69","His music was rooted, encyclopedic, precise and wild as he carried the two-fisted keyboard traditions of his native city to the brink of the avant-garde."
hurricane irma,2018-08-28T17:45:28+0000,"Nearly a Year After Hurricane Maria, Puerto Rico Revises Death Toll to 2,975","The official assessment of deaths related to Hurricane Maria in Puerto Rico has been raised to 2,975, after a new study found a 22 percent increase in deaths."
hurricane irma,2018-08-30T20:27:04+0000,"Government Can Stop Paying to House Puerto Rico Hurricane Victims, Judge Rules","After months of temporary reprieves, the judge says temporary housing vouchers for victims of Hurricane Maria staying in hotels can be ended on Sept. 13."
hurricane irma,2018-08-29T13:30:46+0000,House Hunting in … Anguilla,"After a market slowdown in the wake of Hurricane Irma last year, the Caribbean island is on the rebound, thanks in part to its concrete housing stock. "
hurricane irma,2018-08-14T16:21:17+0000,Puerto Rico Spent 11 Months Turning the Power Back On. They Finally Got to Her.,"The problem-plagued effort to restore electric service after the storm blacked out the whole island last year is finally reaching the last few darkened homes, officials say."
hurricane irma,2018-09-24T09:00:12+0000,It’s ‘One Tough Year’ After Hurricanes Tore Through British Virgin Islands,"While much attention has focused on Puerto Rico’s slow recovery from Hurricanes Maria and Irma, other islands have also struggled. The British Virgin Islands were among the worst hit."
hurricane irma,2018-09-09T21:05:54+0000,Forecasters Expect ‘Rapid Intensification’ of Hurricane Florence,"The National Hurricane Center warned of two life-threatening impacts, especially for South Carolina: storm surge at the coast and freshwater flooding from prolonged rain."
hurricane irma,2018-09-12T23:24:43+0000,Hurricane Florence: Your Forecasting and Climate Questions Answered,"How should we make sense of the different forecasting models? Why is the storm so unpredictable? And, how bad will it be?"
hurricane irma,2018-09-02T22:46:41+0000,"Yes, Mr. Trump, Hurricane Maria Was a ‘Real Catastrophe’",The president said the administration did a “fantastic job” in responding to the 2017 storm in Puerto Rico. A new estimate of the death toll says otherwise.
hurricane irma,2018-09-11T23:46:58+0000,"Trump Calls Storm Response in Puerto Rico, Where 3,000 Died, ‘One of the Best’","“I think that Puerto Rico was an incredible, unsung success,” the president said while touting preparations for another hurricane."
hurricane irma,2018-09-04T13:28:47+0000,Powerful Storm Makes Landfall on the Gulf Coast,"Tropical Storm Gordon made landfall near the Alabama-Mississippi border late Tuesday night, without gathering hurricane strength."
hurricane irma,2018-09-10T16:07:24+0000,"As Hurricane Florence Threatens the Carolinas, 1 Million Ordered to Evacuate","The Southeast is bracing for a major Category 4 storm later this week, with a one-two punch of both wind and storm surge and major inland flooding."
hurricane irma,2018-09-22T14:02:48+0000,"Hurricane Florence Has Gone, but Challenges for the Carolinas Have Just Begun","Already the emergency and recovery response is staggering in scope, and the threats have not abated."
hurricane irma,2018-09-13T01:42:38+0000,Hurricane Florence Is a Formidable Test for FEMA and Trump,"After last year’s harsh lessons, the administration girded for a test of its ability as Hurricane Florence approached the Carolina coast."
hurricane irma,2018-09-15T13:29:30+0000,How to Help Those Affected by Florence,"Residents of the Carolinas face the arduous task of cleaning up, repairing and rebuilding. Here’s how to help."
hurricane irma,2018-09-17T13:37:28+0000,Lean Times for Reinsurers Could Trigger a Wave of M.&A.,"Insurers are bracing for $20 billion of damage from Hurricane Florence, on top of record losses in 2017. The best way to survive may be to buy a rival."
hurricane irma,2018-09-26T09:00:05+0000,Utilities Helped Puerto Rico Fix Its Power Grid. Now They Face Hefty Tax Bills.,Electric companies across the mainland have received tax bills from Puerto Rican cities demanding millions of dollars in payments.
hurricane irma,2018-09-19T19:47:07+0000,"Millions of Carolina Homes Are at Risk of Flooding. Only 335,000 Have Flood Insurance. ",Here’s why the federal flood insurance program won’t pick up the slack.
hurricane irma,2018-09-12T20:08:15+0000,An Insurance Executive Explains Why We Need a Carbon Tax,Cutting greenhouse gas emissions is critical to reduce the risks of exposure to extreme weather like the hurricanes now barreling across the Atlantic.
hurricane irma,2018-09-07T17:13:58+0000,California Says Nursing Homes Abandoned Elderly During Fire,The Department of Social Services has moved to close two nursing homes accused of leaving behind residents during last year’s wildfires.
hurricane irma,2018-09-02T17:00:04+0000,"Summer Winds Down, and Big Tech Is Called Before Congress","The newest jobs numbers are expected to show healthy gains, and Detroit automakers will report sales for August."
hurricane irma,2018-09-24T10:00:01+0000,New York Today: Behind a Police Department Scandal,Monday: Inside an investigation and a monument to the Puerto Rican victims of Hurricane Maria.
hurricane irma,2018-09-26T12:00:05+0000,Cheaper Battery Is Unveiled as a Step to a Carbon-Free Grid,The entrepreneur Patrick Soon-Shiong says his company’s tests of zinc-based storage for solar and wind energy show the potential for large-scale use.
hurricane irma,2018-09-24T21:49:22+0000,"Your Monday Evening News Briefing: Kavanaugh, Rosenstein, Cosby",Here’s what you need to know at the end of the day.
hurricane irma,2018-09-21T09:00:14+0000,Culture and Conservation Beneath the Sea,"From Florida to the Maldives, underwater art installations double as artificial reefs."
hurricane irma,2018-10-11T00:40:36+0000,Hurricane Michael Leaves Trail of Destruction as It Slams Florida’s Panhandle,"Residents and emergency workers spent most of the day hunkered down, only emerging after nightfall to begin assessing the Category 4 storm’s toll."
hurricane irma,2018-10-13T09:00:06+0000,The Price of Fleeing Hurricane Michael: ‘We Are Going to Be Financially Devastated’,"We asked readers to tell us about the costs — financial, physical and emotional — of evacuating from the path of Hurricane Michael. "
hurricane irma,2018-10-10T00:03:54+0000,"A Hurricane’s Coming, but Fear Not, the Governor Is Here. And Here. And Here.","Hurricane Michael arrives in the height of campaign season in Florida, and Gov. Rick Scott, who is running for the Senate, already is in heavy public service mode. So are other Florida politicians."
hurricane irma,2018-10-08T07:00:12+0000,"As Storms Keep Coming, FEMA Spends Billions in ‘Cycle’ of Damage and Repair","FEMA has paid out billions for disaster recovery efforts. But many projects seem to be undertaken in defiance of climate change, leaving structures nearly as vulnerable as before."
hurricane irma,2018-10-11T19:38:45+0000,Hospitals Pummeled by Hurricane Michael Scramble to Evacuate Patients,"One of Panama City’s largest hospitals said on Thursday that it was evacuating all of its approximately 130 inpatients, starting with the most critically ill."
hurricane irma,2018-10-18T20:50:16+0000,Where’d You Hear That? A Rumor Mill Churns Amid Hurricane Michael’s Rubble,Bed bugs have infested a shelter. FEMA is distributing free cash. Rumors like these have swept the Florida Panhandle since the hurricane. It’s like a game of telephone.
hurricane irma,2018-10-29T14:17:41+0000,U.S. October Auto Sales Seen Down Slightly: Consultants,"U.S. auto sales likely fell slightly in October from a year earlier, when replacement demand following hurricanes Harvey and Irma boosted business, industry consultants J.D. Power and LMC Automotive said on Monday."
hurricane irma,2018-10-13T23:46:55+0000,"With Sniffer Dogs and Hope, Rescue Teams Comb Through Hurricane Michael Damage","Under an unflinching Florida sun, the teams looked for the tiniest signs of life amid the wreckage and thick brush."
hurricane irma,2018-10-25T21:53:06+0000,Hundreds of Fish Die Along Florida's Space Coast Beaches,"Hundreds of fish have washed ashore along Florida's Space Coast beaches, a week after the first signs of a toxic algae outbreak were reported."
hurricane irma,2018-10-18T19:05:02+0000,Red Tide Reaches Florida's Space Coast,A toxic algae bloom has reached Florida's Space Coast.
hurricane irma,2018-10-21T21:36:26+0000,Hurricane Michael Victims’ Biggest Fear: ‘People Are Going to Start Forgetting’,"Places hit hard by Hurricane Michael are slowly returning to normal, but residents worry that officials will be in too great a hurry to move on."
hurricane irma,2018-10-10T23:22:13+0000,The ‘Greatest Hoax’ Strikes Florida,Denying climate change doesn’t stop its devastating effects.
hurricane irma,2018-10-26T17:35:09+0000,Activists Demand Closure of Puerto Rico Zoo After Deaths,Animal rights activists demanded Friday that Puerto Rico permanently close its only zoo and relocate all animals to sanctuaries following reports of deaths and improper care.
hurricane irma,2018-10-23T16:07:59+0000,Puerto Ricans Fight for Insurance Money a Year After Maria,"Thousands of Puerto Ricans have been forced to drain their savings, close their businesses, or resign themselves to living with structural damage as they fight insurance companies over millions of dollars' worth of claims that have gone unanswered..."
hurricane irma,2018-10-23T16:41:41+0000,Puerto Rico's Revised Fiscal Plan Approved Over Government Opposition,"Puerto Rico's federally appointed financial oversight board on Tuesday unanimously approved a revised fiscal reform plan meant to put the bankrupt island on a path toward solvency, but faced opposition from its elected government for being too str..."
hurricane irma,2018-10-19T09:00:17+0000,"$2.5 Billion in Storm Losses, but Don’t Ask Georgia Farmers About Climate Change",Cotton farms across Georgia were set to produce their best yields in years. But that was before Hurricane Michael left a trail of devastation.
hurricane irma,2018-10-10T21:49:39+0000,On Politics With Lisa Lerer: They’re Running? Not Yet. (But Yes.),A busy week for people who refuse to say they want to be president; the politics of Hurricane Michael; and a surprisingly close race in New Jersey.
hurricane irma,2018-10-06T01:24:58+0000,Alex Cora Manages the Red Sox and Inspires Boston’s Puerto Ricans,"Cora, 42, is the team’s first Latino manager, and in his first year at the helm he led the Sox to a franchise record 108 regular-season wins."
hurricane irma,2018-10-24T09:00:07+0000,"In a Florida Swing District, an ‘Inconvenient’ Republican Holds On",Representative Carlos Curbelo is a perennial target for Democrats. His political fate might be an indicator of national trends in the 2018 midterms.
hurricane harvey,2018-06-06T17:39:57+0000,Hurricanes Are Lingering Longer. That Makes Them More Dangerous.,"A new study shows that storms are staying in one place longer, much like Hurricane Harvey did last year."
hurricane harvey,2018-06-15T15:19:33+0000,It’s Hurricane Season. Do You Need Flood Insurance?,The federal program is about to lapse. But consumer advocates are urging homeowners to get the coverage.
hurricane harvey,2018-06-01T23:03:34+0000,"Just in Time for Hurricane Season, a New Leader at the Coast Guard’s Helm",Adm. Karl L. Schultz said the military service will hold steady in its growing role in homeland security priorities like immigration and disaster relief.
hurricane harvey,2018-06-27T05:00:03+0000,What’s on TV Wednesday: ‘Big Brother’ and ‘Sicario’,A special investigates the superstorms battering the Atlantic. And “The Last Jedi” arrives on Netflix.
hurricane harvey,2018-06-19T21:08:08+0000,"They Wanted to Raise $1,500 for Immigrant Families at the Border. They Got Over $20 Million.","A couple started a Facebook page to fund legal defenses for families separated at the border. It became the site’s largest single fund-raiser ever, the company said."
hurricane harvey,2018-06-01T04:07:04+0000,"Tariffs, Italy, Telegram: Your Friday Briefing",Here’s what you need to know to start your day.
hurricane harvey,2018-06-28T09:35:21+0000,"Anthony Kennedy, Immigration, World Cup: Your Thursday Briefing",Here’s what you need to know to start your day.
hurricane harvey,2018-06-21T09:00:13+0000,Ted Cruz Is Running Again. Trump Is Still Making Things Complicated.,"The Texas senator, facing a serious re-election challenge, is projecting loyalty to a president he once criticized as erratic and dangerous."
hurricane harvey,2018-06-16T14:36:20+0000,Just the Fear of a Trade War Is Straining the Global Economy,"As President Trump intensifies trade hostilities, the potential for conflict has begun to disrupt business, sowing worries about global economic growth."
hurricane harvey,2018-07-12T22:23:24+0000,"FEMA Was Sorely Unprepared for Puerto Rico Hurricane, Report Says","When a killer storm came to Puerto Rico, FEMA’s warehouse on the island was nearly empty, with not a single tarpaulin or cot left in stock."
hurricane harvey,2018-07-09T10:00:01+0000,New York Today: A New App From the M.T.A.,"Monday: The making of an app for commuters, and the New York City E-Prix."
hurricane harvey,2018-07-04T11:04:01+0000,"A Greener Red, White and Blue?","On this Fourth of July, we’re thinking about the environmental impact of fireworks."
hurricane harvey,2018-07-10T10:00:03+0000,New York Today: The Tale of Tap Dancing,"Tuesday: The history of tap dance in our city, and the “New York Woman” film series."
hurricane harvey,2018-08-03T22:11:47+0000,Chemical Maker and Its Chief Indicted for Explosions During Hurricane Harvey,"The indictment charged that Arkema North America, its chief executive and a plant manager were responsible for the chemical release, which prosecutors said was preventable."
hurricane harvey,2018-08-28T20:17:38+0000,"A Year After Hurricane Harvey, Houston’s Tourism Industry Is Shaken but Recovering","Though the city is still suffering from the lasting effects of the storm, tourists are more likely to experience a city in the midst of recovery. "
hurricane harvey,2018-08-25T00:01:18+0000,What Houston Didn’t Learn from Harvey,It has been a year since the hurricane devastated our city — and more rain will come soon.
hurricane harvey,2018-08-15T19:44:48+0000,This Is Not the Way to Stop Homes From Flooding ,The federal government is considering a plan that could cost taxpayers more money and encourage land speculation without addressing the problem.
hurricane harvey,2018-08-30T04:19:01+0000,Lost in the Storm,"Houston thought it was prepared for a major hurricane like Harvey. But as the flooding overwhelmed the city’s emergency systems, families like the Daileys found out too late that they were on their own."
hurricane harvey,2018-08-30T20:27:04+0000,"Government Can Stop Paying to House Puerto Rico Hurricane Victims, Judge Rules","After months of temporary reprieves, the judge says temporary housing vouchers for victims of Hurricane Maria staying in hotels can be ended on Sept. 13."
hurricane harvey,2018-08-24T15:21:16+0000,"Hurricane Lane Is Downgraded to Tropical Storm, but Hawaii Faces Flooding Threat","The island dealt with flash flooding, heavy winds and unexpected fires, even as officials caught a break when the storm weakened dramatically."
hurricane harvey,2018-08-25T18:45:23+0000,"Hurricane Lane, Now a Tropical Storm, Batters Hawaii With Heavy Rain","Although Lane was downgraded to a tropical storm and its winds are forecast to weaken, rainfall totals are increasing, and the authorities warn of dangerous flash flooding."
hurricane harvey,2018-08-04T17:12:04+0000,Traveling to the Ends of the Earth to Document Climate Change,The photographer George Steinmetz spent a year traveling to every continent for The Times Magazine. Some photos were easier to take than others.
hurricane harvey,2018-08-29T04:01:08+0000,"Well, at Least Sheriff Joe Isn’t Going to Congress",Arpaio’s loss in Arizona’s Senate Republican primary is a fitting end to the public life of a truly sadistic man.
hurricane harvey,2018-08-17T19:13:04+0000,Turning Poetry Into Photos ,Photographers read poems written by 6 women. Here’s what they saw in the words.
hurricane harvey,2018-08-27T09:00:00+0000,‘What’s Going On in This Graph?’ Is Now Weekly. STEM Teachers Explain Why It’s a Powerful Activity.,"Each week we select an engaging Times graph and pair it with a simple protocol — asking students what they notice, what they wonder, and what they think is going on in the graph."
hurricane harvey,2018-08-17T09:00:10+0000,"In a Divided Era, One Thing Seems to Unite: Political Anger","Disputes over politics have divided Americans’ homes, strained marriages, ruined friendships and invaded the workplace."
hurricane harvey,2018-08-02T09:00:09+0000,When School Gets Real: Teachers Connect Classroom Lessons to Current Events,Over 40 teachers tell us how they’re linking their curriculum to what’s happening in the world outside school.
hurricane harvey,2018-08-01T04:47:33+0000,Losing Earth: The Decade We Almost Stopped Climate Change,"We knew everything we needed to know, and nothing stood in our way. Nothing, that is, except ourselves. A tragedy in two acts."
hurricane harvey,2018-09-12T14:50:59+0000,Relief for Hurricane Harvey Survivors,A legal advocate discusses the obstacles posed by FEMA.
hurricane harvey,2018-09-06T09:00:12+0000,"By All Appearances, They Overcame Hurricane Harvey. Appearances Are Deceiving.","A year after the storm wrecked parts of Texas and the Gulf Coast, one family has managed to repair their home. But nothing is easy. And nothing is the same."
hurricane harvey,2018-09-03T06:00:04+0000,"A Year After Hurricane Harvey, Houston’s Poorest Neighborhoods Are Slowest to Recover","Texas has made progress recuperating from Hurricane Harvey, but low-income and minority residents have had a much harder time."
hurricane harvey,2018-09-13T09:00:16+0000,Hurricane Florence Is Going to Slow Down. That’s Not Good.,The storm won’t be alone: Tropical cyclones have grown more sluggish since the mid-20th century. Here’s why that’s a bad thing.
hurricane harvey,2018-09-19T18:58:42+0000,Humans Are Making Hurricanes Worse. Here’s How. ,"We’re making natural disasters unnaturally harmful, scientists say. And the number of ways we’re doing it is fairly astonishing."
hurricane harvey,2018-09-12T23:24:43+0000,Hurricane Florence: Your Forecasting and Climate Questions Answered,"How should we make sense of the different forecasting models? Why is the storm so unpredictable? And, how bad will it be?"
hurricane harvey,2018-09-18T18:38:37+0000,"Tips for Life After Florence, From Those Who’ve Been There",Readers who have lived through other major hurricanes told their stories and offered advice for people affected by Hurricane Florence.
hurricane harvey,2018-09-11T22:12:23+0000,"Is It a Category 2, 3 or 5? How Florence and Other Hurricanes Are Classified","Meteorologists use wind speeds to determine a hurricane’s category, but that doesn’t tell the whole story."
hurricane harvey,2018-09-13T09:54:40+0000,"Lost in the Storm, Part 1","Houston’s emergency response systems, crippled by Hurricane Harvey, failed to reach people who needed help the most."
hurricane harvey,2018-09-14T10:04:25+0000,"Lost in the Storm, Part 2","As a family struggled to get help during Hurricane Harvey, gaps in the rescue system began to show."
hurricane harvey,2018-09-11T23:57:55+0000,"As Florence’s Power Nears the Carolinas, Residents Brace for the Worst","A powerful Category 4 hurricane could linger along the coasts of North Carolina, South Carolina and Virginia, and deliver a huge life-threatening storm surge."
hurricane harvey,2018-09-13T22:50:46+0000,"Is Climate Change Making Hurricanes Worse? Yes, Here’s Why.","Rising ocean temperatures have fueled some of the most devastating storms in recent years. Kendra Pierre-Louis, a reporter on The New York Times’s climate team, explains how."
hurricane harvey,2018-09-10T16:07:24+0000,"As Hurricane Florence Threatens the Carolinas, 1 Million Ordered to Evacuate","The Southeast is bracing for a major Category 4 storm later this week, with a one-two punch of both wind and storm surge and major inland flooding."
hurricane harvey,2018-09-04T13:28:47+0000,Powerful Storm Makes Landfall on the Gulf Coast,"Tropical Storm Gordon made landfall near the Alabama-Mississippi border late Tuesday night, without gathering hurricane strength."
hurricane harvey,2018-09-11T16:01:31+0000,Evacuating for Hurricane Florence: How to Prepare Yourself,"Here are some tips for getting ready: Make a plan, bring documents, close lids, clear the yard, blast the freezer."
hurricane harvey,2018-09-02T22:46:41+0000,"Yes, Mr. Trump, Hurricane Maria Was a ‘Real Catastrophe’",The president said the administration did a “fantastic job” in responding to the 2017 storm in Puerto Rico. A new estimate of the death toll says otherwise.
hurricane harvey,2018-09-12T11:00:26+0000,Catastrophic Rain Predicted as Hurricane Moves Toward Carolinas,Forecasters warned that Hurricane Florence might produce severe flooding in a larger swath of the coast and farther inland than previously predicted.
hurricane harvey,2018-09-13T21:18:38+0000,"While Residents Are Urged to Leave, Inmates Remain in Hurricane’s Path",North Carolina and Virginia have moved inmates inland ahead of Florence. But South Carolina says they are safer where they are.
hurricane harvey,2018-09-13T13:00:45+0000,"As a New Hurricane Roars In, Trump Quarrels Over the Last One","The president dismissed the official death toll of 3,000 from Hurricane Maria, citing far lower numbers, and falsely accused Democrats of inflating the number."
hurricane harvey,2018-09-13T06:00:29+0000,The Hurricane Holdouts Who Never Leave Now Face a ‘Monster’ Storm,"Those who stay put regardless of rain, wind and flooding frustrate emergency officials every time a hurricane approaches. And now Hurricane Florence is looming."
hurricane harvey,2018-09-14T13:57:18+0000,Keep Your Notebook Dry: What Times Reporters Learned From Covering Hurricanes,"Our correspondents share their most vivid memories of covering past storms, and the lessons that they taught them."
