search query,article date,article title,article summary
hurricane maria,2018-08-30T00:20:37+0000,Trump Claims ‘We Did a Fantastic Job in Puerto Rico’,"President Trump asserted that Puerto Rico’s power utility was “dead” and that electricity was “gone” even before Hurricane Maria hit the island in September 2017. The utility was in disrepair but still operational, and the island was not in the da..."
hurricane maria,2018-08-30T20:27:04+0000,"Government Can Stop Paying to House Puerto Rico Hurricane Victims, Judge Rules","After months of temporary reprieves, the judge says temporary housing vouchers for victims of Hurricane Maria staying in hotels can be ended on Sept. 13."
hurricane maria,2018-08-14T16:21:17+0000,Puerto Rico Spent 11 Months Turning the Power Back On. They Finally Got to Her.,"The problem-plagued effort to restore electric service after the storm blacked out the whole island last year is finally reaching the last few darkened homes, officials say."
hurricane maria,2018-08-10T23:24:09+0000,Containers of Hurricane Donations Found Rotting in Puerto Rico Parking Lot,"The containers, collected from private donors by a group controlled by Puerto Rico’s first lady, are sitting in a state parking lot, crumbling and infested with rats."
hurricane maria,2018-08-10T17:37:42+0000,Helping Puerto Rico Recover,An advocate argues for transparency in hurricane aid relief.
hurricane maria,2018-08-15T00:29:05+0000,"Quotation of the Day: 11 Months in the Dark; Then, Click, Brightness","Quotation of the Day for Wednesday, August 15, 2018."
hurricane maria,2018-08-16T23:40:09+0000,Cuomo’s New Opponent: Trump,Gov. Andrew M. Cuomo is facing activist and actress Cynthia Nixon in New York’s Democratic primary next month. But in public appearances the governor is focusing on a different rival: President Trump.
hurricane maria,2018-08-09T22:02:51+0000,"Space Force, Trump, Yemen: Your Thursday Evening Briefing",Here’s what you need to know at the end of the day.
hurricane maria,2018-08-23T21:00:04+0000,7 Plays and Musicals to Go to in N.Y.C. This Weekend,"Previews, openings and some last-chance picks."
hurricane maria,2018-08-29T09:27:15+0000,"Primary Elections, Nafta, Google: Your Wednesday Briefing",Here’s what you need to know to start your day.
hurricane maria,2018-08-29T03:40:34+0000,"Nafta, Pope Francis, Russia: Your Wednesday Briefing",Here’s what you need to know to start your day.
hurricane maria,2018-08-14T22:02:47+0000,"Catholic Church, Turkey, Omarosa Manigault Newman: Your Tuesday Evening Briefing",Here’s what you need to know at the end of the day.
hurricane maria,2018-08-28T22:09:54+0000,"Nafta, Google, Trump: Your Tuesday Evening Briefing",Here’s what you need to know at the end of the day.
hurricane maria,2018-08-06T09:00:05+0000,"Meet Bill Nelson, the Under-the-Radar Senate Candidate in Florida. He’s the Incumbent.","Though he has served three terms, Bill Nelson, a Democrat, has less name recognition and less campaign money than his Republican challenger, Gov. Rick Scott, and some Democrats worry that he could lose his seat."
hurricane maria,2018-08-10T04:10:49+0000,"NATO, Extreme Heat, Chess: Your Friday Briefing",Here’s what you need to know to start your day.
hurricane maria,2018-08-28T20:37:41+0000,"Google, Pope Francis, Duterte: Your Wednesday Briefing",Here’s what you need to know to start your day.
hurricane maria,2018-08-09T20:05:56+0000,"North Korea, Russia, Samsung: Your Friday Briefing",Here’s what you need to know to start your day.
hurricane maria,2018-08-01T13:00:36+0000,"$1.9 Million Homes in California, Alaska and Louisiana","A Spanish-style house in Los Angeles, a modernist home in Anchorage and a renovated 19th-century house in New Orleans."
hurricane maria,2018-08-09T09:44:02+0000,"Chris Collins, Argentina, Bill Hybels: Your Thursday Briefing",Here’s what you need to know to start your day.
hurricane maria,2018-08-17T19:13:04+0000,Turning Poetry Into Photos ,Photographers read poems written by 6 women. Here’s what they saw in the words.
hurricane maria,2018-08-16T21:34:10+0000,Cuomo vs. Nixon? He’d Rather Campaign Against Trump,Gov. Andrew Cuomo’s motivation behind his recent attacks on the president has more to do with his re-election this year than any ambitions in 2020.
hurricane maria,2018-08-15T09:24:03+0000,"Primary Elections, Catholic Church, Turkey: Your Wednesday Briefing",Here’s what you need to know to start your day.
hurricane maria,2018-08-13T18:14:36+0000,Letitia James Has Embraced Andrew Cuomo. Is It Worth It?,The question of who is more independent from Gov. Andrew M. Cuomo has jump-started the Democratic primary for New York State attorney general.
hurricane maria,2018-08-28T09:00:12+0000,"In the Azores, the Menu Includes Coffee, Tea and Tradition","There’s wine and cheese too, in these remote islands in the Atlantic Ocean. Here’s where to get a taste of the past — and present."
hurricane maria,2018-08-20T18:49:50+0000,Summer 2018 News Quiz | June 1-Aug. 31,This summer has produced dramatic headlines around the world. Here are 50 questions to test what you remember and help you learn more.
hurricane maria,2018-08-13T09:00:14+0000,"10 Travel Writers, 10 Favorite Hotels","From an English country inn to a Caribbean beach resort, places our correspondents love to stay (you will like them too)."
hurricane maria,2018-09-22T09:00:10+0000,"Photos: Hurricane Maria, and Puerto Rico One Year Later","A team of New York Times journalists went door to door in Punta Santiago, visiting 163 homes. Here’s a dramatic visual presentation of what they found."
hurricane maria,2018-09-20T08:00:12+0000,Creativity From the Chaos of Hurricane Maria,"One year later, artists in Puerto Rico and those attached to the island talk about how the devastation and its aftermath influenced their work."
hurricane maria,2018-09-20T06:18:57+0000,"On Hurricane Maria Anniversary, Puerto Rico Is Still in Ruins",The New York Times visited more than 150 homes in Punta Santiago to document the damage that remains a year after Hurricane Maria.
hurricane maria,2018-09-02T22:46:41+0000,"Yes, Mr. Trump, Hurricane Maria Was a ‘Real Catastrophe’",The president said the administration did a “fantastic job” in responding to the 2017 storm in Puerto Rico. A new estimate of the death toll says otherwise.
hurricane maria,2018-09-19T08:00:01+0000,He Photographed What Hurricane Maria ‘Couldn’t Take Away’ From His Family,Jose Alvarado Jr. set out to capture quiet moments that are rooted in his family’s experiences yet speak to those of countless others.
hurricane maria,2018-09-13T23:16:26+0000,Trump’s False Claims Rejecting Puerto Rico’s Death Toll From Hurricane Maria,"In a pair of tweets casting doubt on the official estimate of nearly 3,000 deaths, the president clung to an outdated estimate, wrongly suggested that doubt over the figure emerged “a long time later” and inaccurately characterized the new figure ..."
hurricane maria,2018-09-20T20:23:51+0000,Sunrise Melodies and Tearful Reflections: Puerto Rico a Year After Maria,Puerto Ricans came together to count their losses and reflect on life after Hurricane Maria.
hurricane maria,2018-09-24T09:00:12+0000,It’s ‘One Tough Year’ After Hurricanes Tore Through British Virgin Islands,"While much attention has focused on Puerto Rico’s slow recovery from Hurricanes Maria and Irma, other islands have also struggled. The British Virgin Islands were among the worst hit."
hurricane maria,2018-09-13T13:00:45+0000,"As a New Hurricane Roars In, Trump Quarrels Over the Last One","The president dismissed the official death toll of 3,000 from Hurricane Maria, citing far lower numbers, and falsely accused Democrats of inflating the number."
hurricane maria,2018-09-22T18:30:09+0000,Back From the Storm,"In Puerto Rico, communities are still reeling from the destruction of Hurricane Maria."
hurricane maria,2018-09-11T23:46:58+0000,"Trump Calls Storm Response in Puerto Rico, Where 3,000 Died, ‘One of the Best’","“I think that Puerto Rico was an incredible, unsung success,” the president said while touting preparations for another hurricane."
hurricane maria,2018-09-13T01:42:38+0000,Hurricane Florence Is a Formidable Test for FEMA and Trump,"After last year’s harsh lessons, the administration girded for a test of its ability as Hurricane Florence approached the Carolina coast."
hurricane maria,2018-09-13T21:37:55+0000,On Politics With Lisa Lerer: Florence and Maria,The president says Democrats padded the death toll in Puerto Rico; tips from former leaders on how to prepare for a hurricane.
hurricane maria,2018-09-14T10:00:04+0000,Why Do People Stay When a Hurricane Comes?,"The messy truth lies in between two common, incorrect tropes."
hurricane maria,2018-09-14T18:38:57+0000,Trump’s Trail of Distortions and Lies,"Two readers are shocked by the president’s denial of the death toll in Puerto Rico, and a psychiatrist discusses pathological lying. "
hurricane maria,2018-09-11T22:12:23+0000,"Is It a Category 2, 3 or 5? How Florence and Other Hurricanes Are Classified","Meteorologists use wind speeds to determine a hurricane’s category, but that doesn’t tell the whole story."
hurricane maria,2018-09-13T23:17:36+0000,What Trump Doesn’t Get About Disasters,How we define a calamity determines how we plan for and respond to them. Or not.
hurricane maria,2018-09-13T23:34:09+0000,Trump Honors Only One Victim in Puerto Rico: Himself,"The president sees the accepted death toll of nearly 3,000 as evidence of a political conspiracy against him. "
hurricane maria,2018-09-01T18:30:03+0000,Don’t Give Trump a Pass on Puerto Rico,"The president thinks the government did a fantastic job last year handling Hurricane Maria. But the revision of the death toll, to nearly 3,000 from 64, says different."
hurricane maria,2018-09-12T23:24:43+0000,Hurricane Florence: Your Forecasting and Climate Questions Answered,"How should we make sense of the different forecasting models? Why is the storm so unpredictable? And, how bad will it be?"
hurricane maria,2018-09-26T09:00:05+0000,Utilities Helped Puerto Rico Fix Its Power Grid. Now They Face Hefty Tax Bills.,Electric companies across the mainland have received tax bills from Puerto Rican cities demanding millions of dollars in payments.
hurricane maria,2018-09-24T20:00:03+0000,Puerto Rico sigue en ruinas a un año del huracán María,"The New York Times visitó más de 150 hogares en Punta Santiago, donde documentó la permanencia de los daños un año después del huracán María."
hurricane maria,2018-09-10T16:07:24+0000,"As Hurricane Florence Threatens the Carolinas, 1 Million Ordered to Evacuate","The Southeast is bracing for a major Category 4 storm later this week, with a one-two punch of both wind and storm surge and major inland flooding."
hurricane maria,2018-09-14T12:20:16+0000,Trump Keeps Lying about the Deaths of Americans ,"Also: Ten years after the collapse of Lehman Brothers, we’re using the wrong measures of the economy."
hurricane maria,2018-09-13T09:01:13+0000,Trevor Noah Doesn’t Think Trump Is Prepared for Hurricane Florence,President Trump claims his response to Hurricane Maria in Puerto Rico was a big success. Mr. Noah disagrees.
hurricane maria,2018-09-12T11:00:26+0000,Catastrophic Rain Predicted as Hurricane Moves Toward Carolinas,Forecasters warned that Hurricane Florence might produce severe flooding in a larger swath of the coast and farther inland than previously predicted.
hurricane maria,2018-09-22T14:02:48+0000,"Hurricane Florence Has Gone, but Challenges for the Carolinas Have Just Begun","Already the emergency and recovery response is staggering in scope, and the threats have not abated."
hurricane maria,2018-09-13T16:37:41+0000,FEMA Chief’s Dual Challenge: Huge Hurricane and Inspector General Inquiry,Brock Long has been forced to undertake a measure of personal damage control over his use of agency vehicles just as he is leading a high-stakes emergency effort.
hurricane maria,2018-09-04T13:28:47+0000,Powerful Storm Makes Landfall on the Gulf Coast,"Tropical Storm Gordon made landfall near the Alabama-Mississippi border late Tuesday night, without gathering hurricane strength."
hurricane maria,2018-09-24T09:00:07+0000,Trump Stands by ‘Fantastic’ Kavanaugh as He Seeks G.O.P. Votes,"In a radio interview with Geraldo Rivera to be broadcast Monday, the president cast doubt on the sexual assault allegation against Judge Brett M. Kavanaugh."
hurricane maria,2018-09-14T23:28:55+0000,"Maria Torres, Ranked No. 184, Keeps a Share of the Evian Championship Lead","A rookie playing in only her second major tournament, Torres shared the lead with three players, while Sung Hyun Park, the world No. 1, missed the cut."
hurricane maria,2018-09-14T08:58:17+0000,Stephen Colbert Says Trump Is ‘Laser-Focused’ on the Storm (Last Year’s),"As Hurricane Florence approached, the president was busy disputing the death toll from Hurricane Maria, the “Late Show” host noticed."
hurricane maria,2018-09-13T22:01:51+0000,"Your Thursday Evening News Briefing: Hurricane Florence, Trump, Brett Kavanaugh",Here’s what you need to know at the end of the day.
hurricane maria,2018-09-17T13:37:28+0000,Lean Times for Reinsurers Could Trigger a Wave of M.&A.,"Insurers are bracing for $20 billion of damage from Hurricane Florence, on top of record losses in 2017. The best way to survive may be to buy a rival."
hurricane maria,2018-09-18T11:38:24+0000,Scenes From a Faded Motel Sheltering Florence Evacuees,"For people who fled from Hurricane Florence, this inn in Fayetteville has become a last-ditch shelter."
hurricane maria,2018-09-13T22:28:12+0000,Maria Torres and Carlota Ciganda Take the Early Lead at the Evian Championship,"Torres, a rookie who is the first player from Puerto Rico with a full L.P.G.A. card, had an eagle to help offset two bogeys in the opening round of the Evian, the tour’s fifth major tournament."
hurricane maria,2018-09-19T19:47:07+0000,"Millions of Carolina Homes Are at Risk of Flooding. Only 335,000 Have Flood Insurance. ",Here’s why the federal flood insurance program won’t pick up the slack.
hurricane maria,2018-09-13T09:37:08+0000,Wind and Rain Begin Battering North Carolina,The outer bands of Hurricane Florence are lashing at North Carolina. The storm could drop 40 inches of rain in some areas and drive a life-threatening storm surge.
hurricane maria,2018-09-15T13:29:30+0000,How to Help Those Affected by Florence,"Residents of the Carolinas face the arduous task of cleaning up, repairing and rebuilding. Here’s how to help."
hurricane maria,2018-09-25T12:24:49+0000,"Weekly News Quiz for Students: Kavanaugh Hearings, Trade War, Medical Advance",How well did you follow the news this past week? How many of these 10 questions can you get right?
hurricane maria,2018-09-21T22:33:32+0000,"As Florence Death Toll Climbs, Families Grapple with Loss of Infants",At least three of the 42 victims of the storm were under the age of two.
hurricane maria,2018-09-13T09:45:30+0000,"Your Thursday News Briefing: Immigration, Hurricane Florence, Vaping",Here’s what you need to know to start your day.
hurricane maria,2018-09-19T15:35:00+0000,"Touring Storm Damage in the Carolinas, Trump Follows His Own Script","Other presidents have treated natural disaster tours as dignified, even grave affairs. President Trump has deployed humor, enthusiasm and a talent for always finding a silver lining."
hurricane maria,2018-09-24T23:03:56+0000,"North Carolina, a ‘Slow Spender’ State, Struggles to Hand Out Storm Aid",North Carolina has had an especially hard time distributing money earmarked by Congress to help low- and moderate-income homeowners in the wake of disasters.
hurricane maria,2018-09-22T04:21:38+0000,On Politics: This Week’s Biggest Stories,"From the sexual assault allegations against Judge Brett M. Kavanaugh to developments in the Russia investigation, it’s been a busy week in American politics."
hurricane maria,2018-09-14T04:15:44+0000,On Politics: Paul Manafort Is Said to Be Near a Plea Deal,"President Trump’s former campaign chairman is close to a plea agreement with federal prosecutors, people familiar with the case said."
hurricane maria,2018-09-11T09:13:48+0000,More Evacuations as ‘Monster’ Storm Looms,"Officials are imploring people to leave low-lying coastal areas and islands in the storm’s path, and more than one million people are expected to flee."
hurricane maria,2018-09-12T20:08:15+0000,An Insurance Executive Explains Why We Need a Carbon Tax,Cutting greenhouse gas emissions is critical to reduce the risks of exposure to extreme weather like the hurricanes now barreling across the Atlantic.
hurricane maria,2018-09-24T10:00:01+0000,New York Today: Behind a Police Department Scandal,Monday: Inside an investigation and a monument to the Puerto Rican victims of Hurricane Maria.
hurricane maria,2018-09-23T10:10:32+0000,"Your Weekend Briefing: Brett Kavanaugh, Hurricane Florence, Russia",Here’s what you need to know about the week’s top stories.
hurricane maria,2018-09-14T09:40:26+0000,"Your Friday News Briefing: Hurricane Florence, New York, ‘Predator’",Here’s what you need to know to start your day.
hurricane maria,2018-09-11T22:59:11+0000,Trump Boasts of ‘Unsung Success’ in Puerto Rico After Deadly Hurricane,President Trump praised his administration’s widely criticized response to Hurricane Maria last year and said the government was ready for Hurricane Florence.
hurricane maria,2018-09-19T18:07:58+0000,"As Storms Loom, Some Immigrant Families Wonder: Is It Safe to Seek Help?","For undocumented families living in fear of deportation, Florence presented an extra challenge: Whether to seek government shelter, food or other aid."
hurricane maria,2018-09-15T19:26:19+0000,Amy Olson Takes Evian Lead in Bid for Her First Major Title,"Olson, who shot a six-under 65 for the second straight day, is trying to become the first United States player to win a women’s major this year."
hurricane maria,2018-09-13T22:53:52+0000,Florence’s Floodwaters Breach Coal Ash Pond and Imperil Other Toxic Sites,"The storm has begun washing coal ash, which contains toxic residue, out of a storage pond in North Carolina. The flooding is also raising fears about Superfund sites, chemical plants and hog farms with waste lagoons."
hurricane maria,2018-09-23T23:31:38+0000,Jeff Bezos and the Trap of the Charitable-Industrial Complex,He has promised money for schools. There are several grass-roots efforts to spread the Montessori method that could really use some.
hurricane maria,2018-09-23T21:44:03+0000,Presidential Lying Is Contagious,Donald Trump’s chronic dishonesty threatens to infect his entire administration.
hurricane maria,2018-09-14T05:00:04+0000,What’s on TV Friday: ‘The First’ and ‘The Land of Steady Habits’,Sean Penn has his first major TV role on Hulu. And a new Nicole Holofcener film hits Netflix.
hurricane maria,2018-09-12T09:47:12+0000,"Your Wednesday News Briefing: Florence, New Hampshire, Apple Event",Here’s what you need to know to start your day.
hurricane maria,2018-09-20T22:00:44+0000,"Your Thursday Evening News Briefing: Brett Kavanaugh, Maryland, Puerto Rico",Here’s what you need to know at the end of the day.
hurricane maria,2018-09-05T09:00:16+0000,A Rural Town Banded Together to Open a Hospital. Its Foe? A Larger Hospital.,"Even when a town wants to open a new hospital to make up for a lack of health care, the challenges can be enormous."
hurricane maria,2018-09-12T16:32:48+0000,"Protection of Voting Rights for Minorities Has Fallen Sharply, a New Report Finds","The head of the federal Civil Rights Commission, which was crucial in passing the 1965 Voting Rights Act, says voting rights protections are dangerously low."
hurricane maria,2018-09-10T17:54:50+0000,Gabrielle Hamilton and Ashley Merriman Exit the Spotted Pig,"The two chefs have abandoned their effort to help rehabilitate the restaurant, whose owner, Ken Friedman, has been accused of sexual harassment."
hurricane maria,2018-09-08T10:00:00+0000,"Champions in the Ring, and Out","Since boxing was legalized in Puerto Rico in 1927, the island has produced dozens of world champions and even more casual enthusiasts."
hurricane maria,2018-09-24T21:49:22+0000,"Your Monday Evening News Briefing: Kavanaugh, Rosenstein, Cosby",Here’s what you need to know at the end of the day.
hurricane maria,2018-09-21T09:31:17+0000,"Your Friday News Briefing: Christine Blasey Ford, Boston Red Sox, ‘Maniac’",Here’s what you need to know to start your day.
hurricane maria,2018-09-06T18:32:06+0000,"Stan Brock, 82, Intrepid Provider of Health Care in Remote Areas, Dies","A British-born former cowboy in South America and a “Wild Kingdom” TV star, he went on to deploy mobile clinics to treat the underserved and uninsured."
hurricane maria,2018-09-20T20:20:48+0000,"Your Friday News Briefing: Russia, India, Pandas",Here’s what you need to know to start your day.
hurricane maria,2018-09-21T04:23:50+0000,"Your Friday News Briefing: Russia, Brexit, Puerto Rico",Here’s what you need to know to start your day.
hurricane maria,2018-09-06T21:00:03+0000,16 Plays and Musicals to Go to in N.Y.C. This Weekend,"Previews, openings and some last-chance picks."
hurricane maria,2018-09-20T21:51:10+0000,On Politics With Lisa Lerer: Her Story? Or Theirs?,"How a #MeToo story gets transformed into a political football, previewing the Beto-Cruz debate, and the president’s approval rating."
hurricane maria,2018-09-25T12:26:13+0000,First Comes the ‘Shocking’ News. Then Comes the Navel-Gazing.,"A firehose of news (and reactions to it) keeps many of us in a state of alarm. Does that make us more sensitive to the world around us, or less?"
hurricane maria,2018-09-13T10:00:01+0000,New York Primary Voters: Here’s Your Election Cheat Sheet,Thursday: Who’s running and where to vote along with exotic animal busts.
hurricane maria,2018-09-22T16:00:00+0000,Me and My White Teachers,"In this week’s Race/Related newsletter: we discuss the importance of diversity among teachers, how to respond when you hear a racist remark, and more."
hurricane maria,2018-09-21T09:30:08+0000,On the Attack Against Climate Change,"Local groups, individuals and multinational organizations are finding effective ways, big and small, to mitigate the effects."
hurricane maria,2018-09-12T18:07:14+0000,"Classical Fall Preview: Debuts, Premieres, a New Philharmonic Maestro",Our classical music editor offers more than 100 highlights from the coming season.
hurricane maria,2018-10-11T13:36:22+0000,Tallying the Dead: Why a Storm Death in One State Might Not Count in Another,Inconsistencies in classifying deaths have made it difficult to compare the magnitude of different disasters.
hurricane maria,2018-10-23T16:07:59+0000,Puerto Ricans Fight for Insurance Money a Year After Maria,"Thousands of Puerto Ricans have been forced to drain their savings, close their businesses, or resign themselves to living with structural damage as they fight insurance companies over millions of dollars' worth of claims that have gone unanswered..."
hurricane maria,2018-10-08T07:00:12+0000,"As Storms Keep Coming, FEMA Spends Billions in ‘Cycle’ of Damage and Repair","FEMA has paid out billions for disaster recovery efforts. But many projects seem to be undertaken in defiance of climate change, leaving structures nearly as vulnerable as before."
hurricane maria,2018-10-22T15:02:00+0000,"The Latest: Hurricane Willa Now Category 4, Still Dangerous",The latest on Hurricane Willa and other storms (all times local):
hurricane maria,2018-10-22T04:05:22+0000,Category 4 Hurricane Willa Threatens Mexico's Pacific Coast,"A potential catastrophic Hurricane Willa swept toward Mexico's Pacific coast with winds of 145 mph (230 kph) Monday night, threatening a stretch of high-rise resort hotels, surfing beaches and fishing villages."
hurricane maria,2018-10-24T00:31:15+0000,Hurricane Willa Weakens in Mexico After Thousands Are Evacuated,"Once a Category 3 hurricane, the storm lost much of its power after making landfall in west-central Mexico, but flooding remained a serious threat."
hurricane maria,2018-10-22T17:11:05+0000,"Study: Puerto Ricans in Florida After Storm Below 50,000","The number of Puerto Ricans who moved to Florida after Hurricane Maria may have been overestimated in previous studies and media accounts, according to new research."
hurricane maria,2018-10-15T13:00:09+0000,The Senate’s White-State Bonus,It’s time to end the longest stretch in American history without a new state.
hurricane maria,2018-10-23T06:29:15+0000,"Hurricane Willa Batters Mexico, Sparking Floods, Outages","Hurricane Willa slammed into Mexico's Pacific coast late on Tuesday, raking it with winds of 120 mph (195 kph) that brought power outages, buffeted buildings, and dumped torrential rain on tourist resorts where thousands of people had moved to saf..."
hurricane maria,2018-10-09T09:00:06+0000,Powerful Hurricane Approaches Florida,"Hurricane Michael is gaining strength as it races toward the Florida Panhandle, threatening to bring ferocious rains, powerful winds and a destructive storm surge."
hurricane maria,2018-10-11T19:38:45+0000,Hospitals Pummeled by Hurricane Michael Scramble to Evacuate Patients,"One of Panama City’s largest hospitals said on Thursday that it was evacuating all of its approximately 130 inpatients, starting with the most critically ill."
hurricane maria,2018-10-13T23:46:55+0000,"With Sniffer Dogs and Hope, Rescue Teams Comb Through Hurricane Michael Damage","Under an unflinching Florida sun, the teams looked for the tiniest signs of life amid the wreckage and thick brush."
